{
  "campaign": "v3-bosch-grid-speed-bridge-phase-b-review",
  "comparison_a_two_stream_grid_movement": [
    {
      "cell_id": "e141_i0.06324555",
      "repeat_behavior": {
        "cd_bottom": {
          "fine_values": [
            0.3239500518350336,
            0.3261940481308431
          ],
          "grid_0.0025_values": [
            0.3187935179717551,
            0.3268289390239455
          ],
          "signed_movements": [
            -0.005156533863278523,
            0.0006348908931024244
          ]
        },
        "cd_middle": {
          "fine_values": [
            0.3227480676919807,
            0.32518892925320925
          ],
          "grid_0.0025_values": [
            0.3235934129532732,
            0.3263031359063414
          ],
          "signed_movements": [
            0.000845345261292485,
            0.001114206653132166
          ]
        },
        "cd_top": {
          "fine_values": [
            0.3310803137650578,
            0.33092273661105076
          ],
          "grid_0.0025_values": [
            0.3291583682640959,
            0.32962884255101904
          ],
          "signed_movements": [
            -0.001921945500961919,
            -0.0012938940600317195
          ]
        },
        "depth": {
          "fine_values": [
            1.2489277093454347,
            1.2492273956772588
          ],
          "grid_0.0025_values": [
            1.2586746828258963,
            1.2510613284803795
          ],
          "signed_movements": [
            0.009746973480461607,
            0.0018339328031207192
          ]
        },
        "max_bow": {
          "fine_values": [
            0.005473720626635814,
            0.006611388340929003
          ],
          "grid_0.0025_values": [
            0.008884980765349326,
            0.006541893237327234
          ],
          "signed_movements": [
            0.003411260138713512,
            -6.94951036017688e-05
          ]
        },
        "scallop_rms": {
          "fine_values": [
            0.0022060569344643306,
            0.0022928079373515237
          ],
          "grid_0.0025_values": [
            0.0021014960306886374,
            0.002103323249339998
          ],
          "signed_movements": [
            -0.00010456090377569324,
            -0.00018948468801152554
          ]
        },
        "sidewall_angle_deg": {
          "fine_values": [
            0.21807077099013925,
            0.14458713621363523
          ],
          "grid_0.0025_values": [
            0.31454048149651515,
            0.08548610285460016
          ],
          "signed_movements": [
            0.0964697105063759,
            -0.05910103335903506
          ]
        }
      },
      "streams": [
        {
          "movement_0.00125_to_0.0025": {
            "cd_bottom": {
              "absolute_delta": 0.005156533863278523,
              "first": 0.3239500518350336,
              "second": 0.3187935179717551,
              "signed_delta_second_minus_first": -0.005156533863278523
            },
            "cd_middle": {
              "absolute_delta": 0.000845345261292485,
              "first": 0.3227480676919807,
              "second": 0.3235934129532732,
              "signed_delta_second_minus_first": 0.000845345261292485
            },
            "cd_top": {
              "absolute_delta": 0.001921945500961919,
              "first": 0.3310803137650578,
              "second": 0.3291583682640959,
              "signed_delta_second_minus_first": -0.001921945500961919
            },
            "depth": {
              "absolute_delta": 0.009746973480461607,
              "first": 1.2489277093454347,
              "second": 1.2586746828258963,
              "signed_delta_second_minus_first": 0.009746973480461607
            },
            "max_bow": {
              "absolute_delta": 0.003411260138713512,
              "first": 0.005473720626635814,
              "second": 0.008884980765349326,
              "signed_delta_second_minus_first": 0.003411260138713512
            },
            "scallop_rms": {
              "absolute_delta": 0.00010456090377569324,
              "first": 0.0022060569344643306,
              "second": 0.0021014960306886374,
              "signed_delta_second_minus_first": -0.00010456090377569324
            },
            "sidewall_angle_deg": {
              "absolute_delta": 0.0964697105063759,
              "first": 0.21807077099013925,
              "second": 0.31454048149651515,
              "signed_delta_second_minus_first": 0.0964697105063759
            }
          },
          "profile_0.0025": {
            "available": true,
            "point_count": 76,
            "width_order_widest_to_narrowest": [
              "cd_top",
              "cd_middle",
              "cd_bottom"
            ]
          },
          "profile_fine": {
            "available": true,
            "point_count": 76,
            "width_order_widest_to_narrowest": [
              "cd_top",
              "cd_bottom",
              "cd_middle"
            ]
          },
          "raw_runtime": {
            "fine_elapsed_s": 981.9464218616486,
            "fine_over_0.0025_ratio": 5.003088794770276,
            "grid_0.0025_elapsed_s": 196.2680380344391
          },
          "rng_seed": 950273,
          "stream": "phase_a_stream"
        },
        {
          "movement_0.00125_to_0.0025": {
            "cd_bottom": {
              "absolute_delta": 0.0006348908931024244,
              "first": 0.3261940481308431,
              "second": 0.3268289390239455,
              "signed_delta_second_minus_first": 0.0006348908931024244
            },
            "cd_middle": {
              "absolute_delta": 0.001114206653132166,
              "first": 0.32518892925320925,
              "second": 0.3263031359063414,
              "signed_delta_second_minus_first": 0.001114206653132166
            },
            "cd_top": {
              "absolute_delta": 0.0012938940600317195,
              "first": 0.33092273661105076,
              "second": 0.32962884255101904,
              "signed_delta_second_minus_first": -0.0012938940600317195
            },
            "depth": {
              "absolute_delta": 0.0018339328031207192,
              "first": 1.2492273956772588,
              "second": 1.2510613284803795,
              "signed_delta_second_minus_first": 0.0018339328031207192
            },
            "max_bow": {
              "absolute_delta": 6.94951036017688e-05,
              "first": 0.006611388340929003,
              "second": 0.006541893237327234,
              "signed_delta_second_minus_first": -6.94951036017688e-05
            },
            "scallop_rms": {
              "absolute_delta": 0.00018948468801152554,
              "first": 0.0022928079373515237,
              "second": 0.002103323249339998,
              "signed_delta_second_minus_first": -0.00018948468801152554
            },
            "sidewall_angle_deg": {
              "absolute_delta": 0.05910103335903506,
              "first": 0.14458713621363523,
              "second": 0.08548610285460016,
              "signed_delta_second_minus_first": -0.05910103335903506
            }
          },
          "profile_0.0025": {
            "available": true,
            "point_count": 76,
            "width_order_widest_to_narrowest": [
              "cd_top",
              "cd_bottom",
              "cd_middle"
            ]
          },
          "profile_fine": {
            "available": true,
            "point_count": 76,
            "width_order_widest_to_narrowest": [
              "cd_top",
              "cd_bottom",
              "cd_middle"
            ]
          },
          "raw_runtime": {
            "fine_elapsed_s": 960.2989947795868,
            "fine_over_0.0025_ratio": 3.5971636584199,
            "grid_0.0025_elapsed_s": 266.9600512981415
          },
          "rng_seed": 950910,
          "stream": "additional_stream"
        }
      ]
    },
    {
      "cell_id": "e50_i0.04",
      "repeat_behavior": {
        "cd_bottom": {
          "fine_values": [
            0.317956768964584,
            0.3238236270421728
          ],
          "grid_0.0025_values": [
            0.32008417387114935,
            0.32333230839871246
          ],
          "signed_movements": [
            0.0021274049065653222,
            -0.0004913186434603589
          ]
        },
        "cd_middle": {
          "fine_values": [
            0.32889778804335734,
            0.32211364689442734
          ],
          "grid_0.0025_values": [
            0.33051442679844273,
            0.32918743205733586
          ],
          "signed_movements": [
            0.0016166387550853867,
            0.007073785162908519
          ]
        },
        "cd_top": {
          "fine_values": [
            0.3307794483862439,
            0.33166273025468007
          ],
          "grid_0.0025_values": [
            0.32958630125676375,
            0.32986038530656153
          ],
          "signed_movements": [
            -0.0011931471294801543,
            -0.0018023449481185394
          ]
        },
        "depth": {
          "fine_values": [
            1.247665456193101,
            1.2532833034440678
          ],
          "grid_0.0025_values": [
            1.2507076664218582,
            1.2541340130120495
          ],
          "signed_movements": [
            0.0030422102287570585,
            0.0008507095679817223
          ]
        },
        "max_bow": {
          "fine_values": [
            0.007940120939260498,
            0.013611961836445557
          ],
          "grid_0.0025_values": [
            0.005790627547731603,
            0.005035600603346541
          ],
          "signed_movements": [
            -0.002149493391528895,
            -0.008576361233099017
          ]
        },
        "scallop_rms": {
          "fine_values": [
            0.002513088216546205,